Date,Time,Time Zone,Currency,Event,Importance,Actual,Forecast,Previous
Sun Feb 12,23:50,GMT,jpy,JPY Gross Domestic Product Deflator (YoY),Low,-1.6%,-1.7%,-2.1%
Sun Feb 12,23:50,GMT,jpy,JPY Nominal Gross Domestic Product (QoQ),High,-0.8%,-0.7%,1.5%
Sun Feb 12,23:50,GMT,jpy,JPY Gross Domestic Product Annualized,High,-2.3%,-1.3%,7.0%
Sun Feb 12,23:50,GMT,jpy,JPY Gross Domestic Product (QoQ),High,-0.6%,-0.3%,1.7%
Sun Feb 12,23:50,GMT,jpy,JPY Tertiary Industry Index (MoM),Medium,1.4%,0.7%,-0.6%
Mon Feb 13,00:30,GMT,aud,AUD Home Loans,Medium,2.3%,1.8%,1.8%
Mon Feb 13,00:30,GMT,aud,AUD Investment Lending,Medium,7.5%,,2.7%
Mon Feb 13,00:30,GMT,aud,AUD Owner-Occupied Home Loan Value (MoM),Low,2.0%,,2.4%
Mon Feb 13,07:00,GMT,eur,EUR German Wholesale Price Index (MoM),Low,1.2%,,0.0%
Mon Feb 13,07:00,GMT,eur,EUR German Wholesale Price Index (YoY),Low,3.0%,,3.0%
Mon Feb 13,08:15,GMT,chf,CHF Producer & Import Prices (YoY),Low,-2.4%,-2.2%,-2.3%
Mon Feb 13,08:15,GMT,chf,CHF Producer & Import Prices (MoM),Low,0.0%,0.2%,0.3%
Mon Feb 13,21:45,GMT,nzd,NZD Food Prices (MoM),Low,0.0%,,0.2%
Mon Feb 13,23:00,GMT,nzd,NZD QV House Prices (YoY),Low,2.7%,,2.4%
Tue Feb 14,,,CNY,CNY Actual FDI (YoY),Medium,,,-12.7%
Tue Feb 14,00:01,GMT,gbp,GBP RICS House Price Balance,Medium,-16%,-17%,-16%
Tue Feb 14,00:30,GMT,aud,AUD NAB Business Conditions,Low,2,,0
Tue Feb 14,00:30,GMT,aud,AUD NAB Business Confidence,Medium,4,,3
Tue Feb 14,02:45,GMT,USD,USD Fed's Williams Speaks in Claremont, CA,LOW,,,
Tue Feb 14,03:01,GMT,nzd,NZD REINZ House Sales (YoY),Medium,25.2%,,20.9%
Tue Feb 14,03:01,GMT,nzd,NZD REINZ House Price Index (MoM),Medium,-1.4%,,-0.1%
Tue Feb 14,03:43,GMT,jpy,JPY Bank of Japan Rate Decision,High,0.10%,0.10%,0.10%
Tue Feb 14,04:30,GMT,jpy,JPY Industrial Production (MoM),Low,3.8%,,4.0%
Tue Feb 14,04:30,GMT,jpy,JPY Industrial Production (YoY),Medium,-4.3%,,-4.1%
Tue Feb 14,04:30,GMT,jpy,JPY Capacity Utilization (MoM),Low,3.1%,,-2.9%
Tue Feb 14,07:45,GMT,eur,EUR French Non-Farm Payrolls (QoQ),Low,-0.2%,-0.2%,0.0%
Tue Feb 14,07:45,GMT,eur,EUR French Wages (QoQ),Low,0.3%,,0.3%
Tue Feb 14,09:30,GMT,gbp,GBP DCLG UK House Prices (YoY),Low,0.1%,,-0.3%
Tue Feb 14,09:30,GMT,gbp,GBP Consumer Price Index (MoM),Medium,-0.5%,-0.5%,0.4%
Tue Feb 14,09:30,GMT,gbp,GBP Core Consumer Price Index (YoY),Medium,2.6%,2.6%,3.0%
Tue Feb 14,09:30,GMT,gbp,GBP Consumer Price Index (YoY),High,3.6%,3.6%,4.2%
Tue Feb 14,09:30,GMT,gbp,GBP Retail Price Index,Low,238.0,238.4,239.4
Tue Feb 14,09:30,GMT,gbp,GBP Retail Price Index (MoM),Low,-0.6%,-0.4%,0.4%
Tue Feb 14,09:30,GMT,gbp,GBP Retail Price Index (YoY),Low,3.9%,4.1%,4.8%
Tue Feb 14,09:30,GMT,gbp,GBP Retail Price Index Ex Mort Int.Payments (YoY),Low,4.0%,4.2%,5.0%
Tue Feb 14,10:00,GMT,eur,EUR Euro-Zone Industrial Production w.d.a. (YoY),Medium,-2.0%,-1.2%,0.1%
Tue Feb 14,10:00,GMT,eur,EUR Euro-Zone Industrial Production s.a. (MoM),Low,-1.1%,-1.2%,0.0%
Tue Feb 14,10:00,GMT,eur,EUR German ZEW Survey (Current Situation),Medium,40.3,30.5,28.4
Tue Feb 14,10:00,GMT,eur,EUR Euro-Zone ZEW Survey (Economic Sentiment),Medium,-8.1,,-32.5
Tue Feb 14,10:00,GMT,eur,EUR German ZEW Survey (Economic Sentiment),High,5.4,-11.8,-21.6
Tue Feb 14,10:00,GMT,eur,EUR Portuguese GDP (QoQ),Medium,-1.3%,-1.5%,-0.6%
Tue Feb 14,10:00,GMT,eur,EUR Portuguese GDP (YoY),Medium,-2.7%,-2.8%,-1.7%
Tue Feb 14,12:30,GMT,usd,USD NFIB Small Business Optimism,Low,93.9,95,93.8
Tue Feb 14,13:30,GMT,usd,USD Import Price Index (MoM),Low,0.3%,0.3%,-0.1%
Tue Feb 14,13:30,GMT,usd,USD Import Price Index (YoY),Low,7.1%,7.2%,8.5%
Tue Feb 14,13:30,GMT,usd,USD Advance Retail Sales,High,0.4%,0.8%,0
Tue Feb 14,13:30,GMT,usd,USD Retail Sales Less Autos,Medium,0.7%,0.5%,-0.5%
Tue Feb 14,13:30,GMT,usd,USD Retail Sales Ex Auto & Gas,Medium,0.6%,0.5%,-0.2%
Tue Feb 14,13:30,GMT,usd,USD Retail Sales "Control Group",Low,0.7%,0.4%,-0.4%
Tue Feb 14,13:45,GMT,USD,USD Fed's Plosser Speaks on Economy in Newark, Delaware,LOW,,,
Tue Feb 14,15:00,GMT,usd,USD Business Inventories,Medium,0.4%,0.5%,0.3%
Tue Feb 14,21:45,GMT,nzd,NZD Retail Sales Ex Inflation (QoQ),Medium,2.2%,1.2%,2.4%
Tue Feb 14,22:40,GMT,USD,USD Fed's Lockhart Speaks on Economic Outlook in Sarasota, Florida,LOW,,,
Tue Feb 14,23:30,GMT,aud,AUD Westpac Consumer Confidence,Medium,4.2%,,2.4%
Tue Feb 14,23:30,GMT,aud,AUD Westpac Consumer Confidence Index,Low,101.1,,97.1
Wed Feb 15,,,USD,USD Revisions: Producer Price Index,LOW,,,
Wed Feb 15,00:30,GMT,aud,AUD New Motor Vehicle Sales (MoM),Low,1.3%,,-2.7%
Wed Feb 15,00:30,GMT,aud,AUD New Motor Vehicle Sales (YoY),Low,2.7%,,-3.0%
Wed Feb 15,02:00,GMT,nzd,NZD Non Resident Bond Holdings,Low,59.3%,,59.1%
Wed Feb 15,05:00,GMT,jpy,JPY Bank of Japan Monthly Report,Low,,,
Wed Feb 15,06:00,GMT,jpy,JPY Machine Tool Orders (YoY) (JAN F),Medium,-6.9%,,-6.6%
Wed Feb 15,06:30,GMT,eur,EUR French Gross Domestic Product (QoQ),Low,0.2%,-0.2%,0.3%
Wed Feb 15,06:30,GMT,eur,EUR French Gross Domestic Product (YoY),Low,1.4%,1.1%,1.5%
Wed Feb 15,07:00,GMT,eur,EUR German Gross Domestic Product n.s.a. (YoY),High,1.5%,1.8%,2.6%
Wed Feb 15,07:00,GMT,eur,EUR German Gross Domestic Product s.a. (QoQ),High,-0.2%,-0.3%,0.6%
Wed Feb 15,07:00,GMT,eur,EUR German Gross Domestic Product w.d.a. (YoY),High,2.0%,1.9%,2.7%
Wed Feb 15,09:00,GMT,eur,EUR Italian Gross Domestic Product s.a. and w.d.a. (QoQ),Low,-0.7%,-0.6%,-0.2%
Wed Feb 15,09:00,GMT,eur,EUR Italian Gross Domestic Product s.a. and w.d.a. (YoY),Low,-0.5%,-0.3%,0.3
Wed Feb 15,09:30,GMT,eur,EUR Italian General Government Debt,Low,1897.9B,,1905.0B
Wed Feb 15,09:30,GMT,gbp,GBP Claimant Count Rate,Medium,5.0%,5.0%,5.0%
Wed Feb 15,09:30,GMT,gbp,GBP Jobless Claims Change,High,6.9K,3.0K,1.9K
Wed Feb 15,09:30,GMT,gbp,GBP Average Weekly Earnings (3M/YoY),Medium,2.0%,1.9%,2.0%
Wed Feb 15,09:30,GMT,gbp,GBP Weekly Earnings exBonus (3M/YoY),Low,2.0%,1.9%,1.9%
Wed Feb 15,09:30,GMT,gbp,GBP ILO Unemployment Rate (3M),Medium,8.4%,8.4%,8.4%
Wed Feb 15,10:00,GMT,eur,EUR Euro-Zone Gross Domestic Product s.a. (QoQ),High,-0.3%,-0.4%,0.1%
Wed Feb 15,10:00,GMT,eur,EUR Euro-Zone Gross Domestic Product s.a. (YoY),High,0.7%,0.7%,1.3%
Wed Feb 15,10:00,GMT,chf,CHF ZEW Survey (Expectations),Medium,-21.2,,-50.1
Wed Feb 15,10:00,GMT,eur,EUR Euro-Zone Trade Balance s.a. (euros),Low,7.5B,4.5B,6.1B
Wed Feb 15,10:00,GMT,eur,EUR Euro-Zone Trade Balance (euros),Low,9.7B,3.5B,6.3B
Wed Feb 15,10:30,GMT,GBP,GBP Bank of England Inflation Report,HIGH,,,
Wed Feb 15,12:00,GMT,usd,USD MBA Mortgage Applications,Low,-1.0%,,7.5%
Wed Feb 15,13:30,GMT,USD,USD Revisions: Consumer Price Index,LOW,,,
Wed Feb 15,13:30,GMT,usd,USD Empire Manufacturing,Low,19.53,15.00,13.48
Wed Feb 15,14:00,GMT,usd,USD Total Net TIC Flows,Low,$87.1B,,$42.9B
Wed Feb 15,14:00,GMT,usd,USD Net Long-term TIC Flows,Medium,$17.9B,$45.0B,$61.3B
Wed Feb 15,14:15,GMT,usd,USD Industrial Production,Medium,0.0%,0.7%,1.0%
Wed Feb 15,14:15,GMT,usd,USD Capacity Utilization,Low,78.5%,78.6%,78.6%
Wed Feb 15,15:00,GMT,usd,USD NAHB Housing Market Index,Low,29,26,25
Wed Feb 15,15:30,GMT,usd,USD DOE U.S. Crude Oil Inventories,Low,-171K,1500K,304K
Wed Feb 15,15:30,GMT,usd,USD DOE Cushing OK Crude Inventory,Low,1990K,,367K
Wed Feb 15,15:30,GMT,usd,USD DOE U.S. Distillate Inventory,Low,-2867K,-1100K,1174K
Wed Feb 15,15:30,GMT,usd,USD DOE U.S. Gasoline Inventories,Low,400K,700K,1629K
Wed Feb 15,17:15,GMT,USD,USD Fed's Fisher Speaks in San Marcos, TX,LOW,,,
Wed Feb 15,19:00,GMT,USD,USD Fed Releases Minutes From Jan. 24-25 FOMC Meeting,HIGH,,,
Wed Feb 15,21:00,GMT,nzd,NZD ANZ NZ Job Ads (MoM),Low,-2.7%,,-2.6%
Wed Feb 15,21:30,GMT,nzd,NZD Business NZ Performance of Manufacturing Index,Medium,50.5,,51.6
Thu Feb 16,00:00,GMT,aud,AUD Consumer Inflation Expectation,Medium,2.5%,,2.8%
Thu Feb 16,00:00,GMT,nzd,NZD ANZ Consumer Confidence Index,Low,113.3,,116.1
Thu Feb 16,00:00,GMT,nzd,NZD ANZ Consumer Confidence (MoM),Low,-2.4%,,7.1%
Thu Feb 16,00:01,GMT,gbp,GBP Nationwide Consumer Confidence,Medium,47,40,38
Thu Feb 16,00:30,GMT,aud,AUD RBA Foreign Exchange Transaction (Australian dollar),Low,383M,,737M
Thu Feb 16,00:30,GMT,aud,AUD Employment Change,High,46.3K,10.0K,-35.6K
Thu Feb 16,00:30,GMT,aud,AUD Unemployment Rate,High,,5.3%,5.2%
Thu Feb 16,00:30,GMT,aud,AUD Full Time Employment Change,Medium,12.3K,0.0K,24.0K
Thu Feb 16,00:30,GMT,aud,AUD Part Time Employment Change,Medium,34.0K,7.5K,-59.6K
Thu Feb 16,00:30,GMT,aud,AUD Participation Rate,Low,65.3%,65.3%,65.2%
Thu Feb 16,04:00,GMT,jpy,JPY Tokyo Condominium Sales (YoY),Low,32.6%,,8.5%
Thu Feb 16,07:00,GMT,eur,EUR EU 25 New Car Registrations,Low,-7.1%,,-6.4%
Thu Feb 16,08:00,GMT,EUR,EUR Greek GDP (YoY),Medium,,,
Thu Feb 16,08:00,GMT,EUR,EUR Spanish GDP (Constant s.a.) (QoQ),Medium,,-0.3%,-0.3%
Thu Feb 16,09:00,GMT,EUR,EUR ECB Publishes Feb. Monthly Report,HIGH,,,
Thu Feb 16,09:00,GMT,eur,EUR Italian Trade Balance (Total) (euros),Low,1447M,,-1583M
Thu Feb 16,09:00,GMT,eur,EUR Italian Trade Balance Eu (euros),Low,-577M,,-389M
Thu Feb 16,10:00,GMT,eur,EUR Italian Current Account (euros),Low,402M,,-3448M
Thu Feb 16,13:30,GMT,cad,CAD International Securities Transactions (Canadian dollar),Low,7.38B,10.00B,14.64B
Thu Feb 16,13:30,GMT,cad,CAD Manufacturing Shipments (MoM),Medium,0.6%,2.0%,1.9%
Thu Feb 16,13:30,GMT,usd,USD Producer Price Index (MoM),Low,0.1%,0.4%,-0.1%
Thu Feb 16,13:30,GMT,usd,USD Producer Price Index Ex Food & Energy (MoM),Low,0.4%,0.2%,0.3%
Thu Feb 16,13:30,GMT,usd,USD Producer Price Index (YoY),Medium,4.1%,4.1%,4.8%
Thu Feb 16,13:30,GMT,usd,USD Initial Jobless Claims,Low,348K,365K,361K
Thu Feb 16,13:30,GMT,usd,USD Producer Price Index Ex Food & Energy (YoY),Medium,3.0%,2.6%,3.0%
Thu Feb 16,13:30,GMT,usd,USD Continuing Claims,Low,3426K,3490K,3526K
Thu Feb 16,13:30,GMT,usd,USD Housing Starts,Medium,699K,675K,689K
Thu Feb 16,13:30,GMT,usd,USD Housing Starts (MoM),Low,1.5%,2.7%,-1.9%
Thu Feb 16,13:30,GMT,usd,USD Building Permits,Medium,676K,680K,671K
Thu Feb 16,13:30,GMT,usd,USD Building Permits (MoM),Low,0.7%,1.3%,-1.3%
Thu Feb 16,14:00,GMT,USD,USD Fed's Bernanke Speaks on Community Banking in Arlington, Va.,Medium,,,
Thu Feb 16,15:00,GMT,usd,USD Mortgage Delinquencies,Low,7.6%,,8.0%
Thu Feb 16,15:00,GMT,usd,USD MBA Mortgage Foreclosures,Low,4.38%,,4.43%
Thu Feb 16,15:00,GMT,usd,USD Philadelphia Fed.,Medium,10.2,9.0,7.3
Thu Feb 16,15:30,GMT,usd,USD EIA Natural Gas Storage Change,Low,-127,,-78
Fri Feb 17,01:35,GMT,cny,CNY MNI Flash Business Sentiment Survey,Low,,,48.8
Fri Feb 17,07:00,GMT,eur,EUR German Producer Prices (MoM),Medium,0.6%,0.3%,-0.4%
Fri Feb 17,07:00,GMT,eur,EUR German Producer Prices (YoY),High,3.4%,3.2%,4.0%
Fri Feb 17,09:00,GMT,eur,EUR Euro-Zone Current Account n.s.a. (euros),Low,16.3B,,1.9B
Fri Feb 17,09:00,GMT,eur,EUR Euro-Zone Current Account s.a. (euros),Low,2.0B,,-0.9B
Fri Feb 17,09:30,GMT,gbp,GBP Retail Sales ex Auto Fuel (MoM),Low,1.2%,-0.3%,0.6%
Fri Feb 17,09:30,GMT,gbp,GBP Retail Sales ex Auto Fuel (YoY),Medium,1.9%,-0.1%,1.4%
Fri Feb 17,09:30,GMT,gbp,GBP Retail Sales w/Auto Fuel (MoM),Low,0.9%,-0.2%,0.6%
Fri Feb 17,09:30,GMT,gbp,GBP Retail Sales w/Auto Fuel (YoY),Medium,2.0%,0.6%,2.5%
Fri Feb 17,10:00,GMT,eur,EUR Euro-Zone Construction Output s.a. (MoM),Low,0.3%,,0.2%
Fri Feb 17,10:00,GMT,eur,EUR Euro-Zone Construction Output w.d.a. (YoY),Low,7.8%,,0.4%
Fri Feb 17,12:00,GMT,cad,CAD Consumer Price Index (MoM),Medium,0.4%,0.3%,-0.6%
Fri Feb 17,12:00,GMT,cad,CAD Consumer Price Index (YoY),High,2.5%,2.3%,2.3%
Fri Feb 17,12:00,GMT,cad,CAD Bank Canada Consumer Price Index Core (MoM),Medium,0.2%,0.1%,-0.5%
Fri Feb 17,12:00,GMT,cad,CAD Bank Canada Consumer Price Index Core (YoY),High,2.1%,1.9%,2.3%
Fri Feb 17,12:00,GMT,cad,CAD Consumer Price Index,Low,120.7,,120.2
Fri Feb 17,13:30,GMT,cad,CAD Leading Indicators (MoM),Medium,0.7%,0.6%,0.7%
Fri Feb 17,13:30,GMT,usd,USD Consumer Price Index (MoM),Medium,0.2%,0.3%,0.0%
Fri Feb 17,13:30,GMT,usd,USD Consumer Price Index Ex Food & Energy (MoM),Medium,0.2%,0.2%,0.1%
Fri Feb 17,13:30,GMT,usd,USD Consumer Price Index (YoY),High,2.9%,2.8%,3.0%
Fri Feb 17,13:30,GMT,usd,USD Consumer Price Index Ex Food & Energy (YoY),High,2.3%,2.2%,2.2%
Fri Feb 17,13:30,GMT,usd,USD Consumer Price Index n.s.a.,Low,226.665,226.573,225.672
Fri Feb 17,13:30,GMT,usd,USD Consumer Price Index Core Index s.a.,Low,227.684,,227.188
Fri Feb 17,15:00,GMT,USD,USD American Petroleum Institute Monthly Report,LOW,,,
Fri Feb 17,15:00,GMT,usd,USD Leading Indicators,Medium,0.4%,0.5%,0.5%
Sat Feb 18,01:30,GMT,cny,China January Property Prices,Medium,,,
