Date,Time,Time Zone,Currency,Event,Importance,Actual,Forecast,Previous
Sun Nov 10,21:45,GMT,nzd,NZD Card Spending Retail (MoM),Medium,1.4%,1.3%,-0.9%
Sun Nov 10,21:45,GMT,nzd,NZD NZ Card Spending (MoM),Medium,1.1%,,-0.3%
Sun Nov 10,23:50,GMT,jpy,JPY Current Account Total (Yen),Low,¥587.3B,¥400.8B,¥161.5B
Sun Nov 10,23:50,GMT,jpy,JPY Adjusted Current Account Total (Yen),Low,-¥125.2B,-¥97.0B,¥351.8B
Sun Nov 10,23:50,GMT,jpy,JPY BoP Current Account Balance (YoY),Low,14.3%,-10.4%,-63.7%
Sun Nov 10,23:50,GMT,jpy,JPY Trade Balance - BOP Basis (Yen),Medium,-¥874.8B,-¥853.9B,-¥885.9B
Sun Nov 10,23:50,GMT,jpy,JPY Bank Lending Banks ex-Trust,Medium,2.3%,,2.2%
Sun Nov 10,23:50,GMT,jpy,JPY Bank Lending incl Trusts (YoY),Medium,2.0%,,2.0%
Mon Nov 11,00:30,GMT,aud,AUD Home Loans,Medium,4.4%,3.5%,-4.0%
Mon Nov 11,00:30,GMT,aud,AUD Investment Lending,Low,5.2%,,0.6%
Mon Nov 11,00:30,GMT,aud,AUD Value of Loans (MoM),Low,5.3%,,-2.8%
Mon Nov 11,04:30,GMT,jpy,JPY Bankruptcies (YoY),Medium,-7.34%,,-11.92%
Mon Nov 11,05:00,GMT,jpy,JPY Eco Watchers Survey: Current,Low,51.8,,52.8
Mon Nov 11,05:00,GMT,jpy,JPY Eco Watchers Survey: Outlook,Medium,54.5,,54.2
Mon Nov 11,08:09,GMT,cny,CNY New Yuan Loans,High,506.1B,580.0B,787.0B
Mon Nov 11,08:09,GMT,cny,CNY Money Supply M0 (YoY),Low,8.0%,8.0%,5.7%
Mon Nov 11,08:09,GMT,cny,CNY Money Supply M1 (YoY),Low,8.9%,9.2%,8.9%
Mon Nov 11,08:09,GMT,cny,CNY Money Supply M2 (YoY),Low,14.3%,14.2%,14.2%
Mon Nov 11,08:09,GMT,cny,CNY Aggregate Financing RMB,Medium,856.4B,1115.0B,1404.9B
Mon Nov 11,21:00,GMT,nzd,NZD REINZ Housing Price Index,Low,3839.8,,3778.1
Mon Nov 11,21:00,GMT,nzd,NZD REINZ House Price Index (MoM),Low,1.6%,,0.8%
Mon Nov 11,21:00,GMT,nzd,NZD REINZ House Sales (YoY),Medium,2.1%,,19.0%
Mon Nov 11,21:00,GMT,nzd,NZD ANZ Truckometer Heavy (MoM),Low,0.3%,,0.0%
Mon Nov 11,23:50,GMT,jpy,JPY Japan Money Stock M2+CD (YoY),Low,4.1%,3.9%,3.9%
Mon Nov 11,23:50,GMT,jpy,JPY Japan Money Stock M3 (YoY),Low,3.3%,3.1%,3.1%
Mon Nov 11,23:50,GMT,jpy,JPY Tertiary Industry Index (MoM),Medium,-0.2%,0.2%,0.6%
Tue Nov 12,00:01,GMT,gbp,GBP RICS House Price Balance,Low,57%,58%,5.3%
Tue Nov 12,00:30,GMT,aud,AUD NAB Business Conditions,Low,-4,,-4
Tue Nov 12,00:30,GMT,aud,AUD NAB Business Confidence,Medium,5,,12
Tue Nov 12,00:30,GMT,aud,AUD Credit Card Balances,Low,A$48.8 B,,A$48.9 B
Tue Nov 12,00:30,GMT,aud,AUD Credit Card Purchases,Low,A$22.0 B,,A$21.8 B
Tue Nov 12,05:00,GMT,jpy,JPY Consumer Confidence Index,Medium,41.2,45.5,45.4
Tue Nov 12,06:00,GMT,jpy,JPY Machine Tool Orders (YoY) (OCT P),Medium,8.4%,,-6.3%
Tue Nov 12,07:00,GMT,eur,EUR German Consumer Price Index (MoM),Low,-0.2%,-0.2%,-0.2%
Tue Nov 12,07:00,GMT,eur,EUR German Consumer Price Index (YoY),Medium,1.2%,1.2%,1.2%
Tue Nov 12,07:00,GMT,eur,EUR German Consumer Price Index - EU Harmonised (MoM),Low,-0.3%,-0.2%,-0.2%
Tue Nov 12,07:00,GMT,eur,EUR German Consumer Price Index - EU Harmonised (YoY),Medium,1.2%,1.3%,1.3%
Tue Nov 12,07:00,GMT,eur,EUR German Wholesale Price Index (MoM),Low,-1.0%,,0.7%
Tue Nov 12,07:00,GMT,eur,EUR German Wholesale Price Index (YoY),Low,-2.7%,,-2.2%
Tue Nov 12,09:30,GMT,gbp,GBP Producer Price Index Input n.s.a. (MoM),Low,-0.6%,-0.7%,-1.0%
Tue Nov 12,09:30,GMT,gbp,GBP Producer Price Index Input n.s.a. (YoY),Low,-0.3%,0.1%,0.9%
Tue Nov 12,09:30,GMT,gbp,GBP Producer Price Index Output n.s.a. (MoM),Low,-0.3%,0.0%,0.0%
Tue Nov 12,09:30,GMT,gbp,GBP Producer Price Index Output n.s.a. (YoY),Medium,0.8%,1.0%,1.2%
Tue Nov 12,09:30,GMT,gbp,GBP Producer Price Index Output Core n.s.a. (MoM),Low,0.1%,0.1%,0.0%
Tue Nov 12,09:30,GMT,gbp,GBP Producer Price Index Output Core n.s.a. (YoY),Medium,0.9%,0.7%,0.8%
Tue Nov 12,09:30,GMT,gbp,GBP DCLG UK House Prices (YoY),Low,3.8%,,3.7%
Tue Nov 12,09:30,GMT,gbp,GBP Consumer Price Index (MoM),Medium,0.1%,0.4%,0.4%
Tue Nov 12,09:30,GMT,gbp,GBP Consumer Price Index (YoY),High,2.2%,2.5%,2.7%
Tue Nov 12,09:30,GMT,gbp,GBP Core Consumer Price Index (YoY),High,1.7%,2.0%,2.2%
Tue Nov 12,09:30,GMT,gbp,GBP Retail Price Index,Low,251.9,253.1,251.9
Tue Nov 12,09:30,GMT,gbp,GBP Retail Price Index (MoM),Low,0.0%,0.5%,0.4%
Tue Nov 12,09:30,GMT,gbp,GBP Retail Price Index (YoY),Medium,2.7%,3.0%,3.2%
Tue Nov 12,09:30,GMT,gbp,GBP Retail Price Index Ex Mort Int.Payments (YoY),Low,2.7%,3.1%,3.2%
Tue Nov 12,12:30,GMT,usd,USD NFIB Small Business Optimism,Low,91.6,93.3,93.9
Tue Nov 12,13:30,GMT,usd,USD Chicago Fed Nat Activity Index,Medium,0.14,0.15,0.13
Tue Nov 12,18:00,GMT,USD,"USD Fed's Kocherlakota Speaks on Monetary Policy in St. Paul, MN",Low,,,
Tue Nov 12,18:50,GMT,USD,"USD Fed's Lockhart Speaks on Economy in Montgomery, Alabama",Low,,,
Tue Nov 12,20:00,GMT,nzd,RBNZ Financial Stability Report,Medium,,,
Tue Nov 12,21:45,GMT,nzd,NZD Food Prices (MoM),Low,-1.0%,,0.0%
Tue Nov 12,23:00,GMT,nzd,RBNZ's Wheeler at Select Committee on Annual Report,Medium,,,
Tue Nov 12,23:30,GMT,aud,AUD Westpac Consumer Confidence,Medium,1.9%,,-2.1%
Tue Nov 12,23:30,GMT,aud,AUD Westpac Consumer Conf Index,Low,110.3,,108.3
Tue Nov 12,23:50,GMT,jpy,JPY Machine Orders (MoM),Low,-2.1%,-1.8%,5.4%
Tue Nov 12,23:50,GMT,jpy,JPY Machine Orders (YoY),Medium,11.4%,12.5%,10.3%
Tue Nov 12,23:50,GMT,jpy,JPY Domestic Corporate Goods Price Index (MoM),Low,-0.1%,-0.2%,0.2%
Tue Nov 12,23:50,GMT,jpy,JPY Domestic Corporate Goods Price Index (YoY),Low,2.5%,2.5%,2.2%
Tue Nov 12,23:50,GMT,jpy,JPY Loans & Discounts Corp (YoY),Low,1.99%,,2.38%
Wed Nov 13,00:00,GMT,USD,USD Fed's Fisher Speaks on Monetary Policy in Australia,Low,,,
Wed Nov 13,,,JPY,JPY Bank of Japan's Miyao Speaks to Business Leaders,Low,,,
Wed Nov 13,00:30,GMT,aud,AUD New Motor Vehicle Sales (MoM),Low,-0.7%,,-0.3%
Wed Nov 13,00:30,GMT,aud,AUD Wage Cost Index (QoQ),Low,0.5%,0.7%,0.7%
Wed Nov 13,00:30,GMT,aud,AUD Wage Cost Index (YoY),Low,2.7%,2.9%,2.9%
Wed Nov 13,00:30,GMT,aud,AUD New Motor Vehicle Sales (YoY),Low,-3.1%,,-3.6%
Wed Nov 13,09:30,GMT,gbp,GBP Claimant Count Rate,Medium,3.9%,3.9%,4.0%
Wed Nov 13,09:30,GMT,gbp,GBP Jobless Claims Change,Medium,-41.7K,-30.0K,-44.7K
Wed Nov 13,09:30,GMT,gbp,GBP Average Weekly Earnings 3M/(YoY),Medium,0.7%,0.7%,0.8%
Wed Nov 13,09:30,GMT,gbp,GBP ILO Unemployment Rate (3M),Medium,7.6%,7.6%,7.7%
Wed Nov 13,09:30,GMT,gbp,GBP Employment Change 3M/3M,Medium,177K,113K,155K
Wed Nov 13,09:30,GMT,gbp,GBP Weekly Earnings ex Bonus 3M/(YoY),Medium,0.8%,0.9%,0.8%
Wed Nov 13,10:00,GMT,eur,EUR Euro-Zone Industrial Production s.a. (MoM),Low,-0.5%,-0.3%,1.0%
Wed Nov 13,10:00,GMT,eur,EUR Euro-Zone Industrial Production w.d.a. (YoY),Medium,1.1%,0.1%,-1.1%
Wed Nov 13,10:30,GMT,GBP,GBP Bank of England Inflation Report,High,,,
Wed Nov 13,12:00,GMT,usd,USD MBA Mortgage Applications,Medium,-1.8%,,-2.8%
Wed Nov 13,13:45,GMT,USD,USD Fed's Pianalto Speaks to Women’s Conference in Philadelphia,Low,,,
Wed Nov 13,14:00,GMT,cad,CAD Teranet/National Bank HPI (MoM),Low,0.1%,,0.0%
Wed Nov 13,14:00,GMT,cad,CAD Teranet/National Bank HPI (YoY),Low,3.1%,,2.7%
Wed Nov 13,14:00,GMT,cad,CAD Teranet/National Bank HP Index,Low,159.34,,159.12
Wed Nov 13,19:00,GMT,usd,USD Monthly Budget Statement,Medium,-$91.6B,-$102.0B,-$120.0B
Wed Nov 13,21:30,GMT,nzd,NZD Business NZ Performance of Manufacturing Index,Medium,55.7,,54.2
Wed Nov 13,21:45,GMT,nzd,NZD Retail Sales Ex Inflation (QoQ),Medium,0.3%,0.9%,1.5%
Wed Nov 13,23:50,GMT,jpy,JPY Japan Buying Foreign Bonds (Yen),Medium,¥357.1B,,¥276.8B
Wed Nov 13,23:50,GMT,jpy,JPY Japan Buying Foreign Stocks (Yen),Medium,-¥98.4B,,-¥35.7B
Wed Nov 13,23:50,GMT,jpy,JPY Foreign Buying Japan Bonds (Yen),Low,-¥322.2B,,¥284.4B
Wed Nov 13,23:50,GMT,jpy,JPY Foreign Buying Japan Stocks (Yen),Low,¥273.1B,,¥247.9B
Wed Nov 13,23:50,GMT,jpy,JPY Gross Domestic Product Annualized,High,1.9%,1.7%,3.8%
Wed Nov 13,23:50,GMT,jpy,JPY Nominal Gross Domestic Product (QoQ),Medium,0.4%,0.4%,1.1%
Wed Nov 13,23:50,GMT,jpy,JPY Gross Domestic Product Deflator (YoY),Low,-0.3%,-0.5%,-0.5%
Wed Nov 13,23:50,GMT,jpy,JPY GDP Business Spending (QoQ),Low,0.2%,1.0%,1.1%
Wed Nov 13,23:50,GMT,jpy,JPY Gross Domestic Product (QoQ),High,0.5%,0.4%,0.9%
Wed Nov 13,23:50,GMT,jpy,JPY GDP Consumer Spending (QoQ),Medium,0.1%,0.2%,0.6%
Thu Nov 14,00:00,GMT,nzd,NZD ANZ Consumer Confidence Index,Low,128.4,,122.3
Thu Nov 14,,,CNY,CNY Foreign Direct Investment (YoY),Medium,,5.7%,4.9%
Thu Nov 14,00:00,GMT,nzd,NZD ANZ Consumer Confidence (MoM),Low,5.0%,,2.9%
Thu Nov 14,00:00,GMT,aud,AUD Consumer Inflation Expectation,Medium,1.9%,,2.0%
Thu Nov 14,00:00,GMT,USD,USD Fed's Bernanke Speaks to Town Hall of Teachers,Low,,,
Thu Nov 14,02:00,GMT,nzd,NZD Non Resident Bond Holdings,Low,64.8%,,67.0%
Thu Nov 14,04:30,GMT,jpy,JPY Industrial Production (MoM),Low,1.3%,,1.5%
Thu Nov 14,04:30,GMT,jpy,JPY Industrial Production (YoY),Medium,5.1%,,5.4%
Thu Nov 14,04:30,GMT,jpy,JPY Capacity Utilization (MoM),Low,1.2%,,-2.1%
Thu Nov 14,06:30,GMT,eur,EUR French Gross Domestic Product (QoQ),Low,-0.1,0.0%,0.5%
Thu Nov 14,06:30,GMT,eur,EUR French Gross Domestic Product (YoY),Medium,0.2%,0.3%,0.5%
Thu Nov 14,07:00,GMT,eur,EUR German Gross Domestic Product s.a. (QoQ),Medium,0.3%,0.3%,0.7%
Thu Nov 14,07:00,GMT,eur,EUR German Gross Domestic Product w.d.a. (YoY),High,0.6%,0.6%,0.5%
Thu Nov 14,07:00,GMT,eur,EUR German Gross Domestic Product n.s.a. (YoY),High,1.1%,1.0%,0.9%
Thu Nov 14,08:15,GMT,chf,CHF Producer & Import Prices (MoM),Low,-0.4%,-0.2%,0.1%
Thu Nov 14,08:15,GMT,chf,CHF Producer & Import Prices (YoY),Low,-0.3%,-0.2%,0.0%
Thu Nov 14,09:00,GMT,EUR,EUR ECB Publishes Monthly Report,Medium,,,
Thu Nov 14,09:00,GMT,eur,EUR Italian Gross Domestic Product s.a. and w.d.a. (QoQ),Low,-0.1%,-0.1%,-0.3%
Thu Nov 14,09:00,GMT,eur,EUR Italian Gross Domestic Product s.a. and w.d.a. (YoY),Medium,-1.9%,-1.9%,-2.2%
Thu Nov 14,09:30,GMT,gbp,GBP Retail Sales Incl. Auto (MoM),Low,-0.7%,0.0%,0.6%
Thu Nov 14,09:30,GMT,gbp,GBP Retail Sales Ex Auto (MoM),Low,-0.6%,-0.1%,0.8%
Thu Nov 14,09:30,GMT,gbp,GBP Retail Sales Ex Auto (YoY),Medium,2.3%,3.1%,2.5%
Thu Nov 14,09:30,GMT,gbp,GBP Retail Sales Incl. Auto (YoY),Medium,1.8%,3.1%,2.0%
Thu Nov 14,10:00,GMT,eur,EUR Euro-Zone Gross Domestic Product s.a. (QoQ),Medium,0.1%,0.1%,0.3%
Thu Nov 14,10:00,GMT,eur,EUR Euro-Zone Gross Domestic Product s.a. (YoY),High,-0.4%,-0.3%,-0.6%
Thu Nov 14,13:30,GMT,cad,CAD New Housing Price Index (MoM),Low,0.0%,0.1%,0.1%
Thu Nov 14,13:30,GMT,cad,CAD New Housing Price Index (YoY),Medium,1.6%,1.7%,1.8%
Thu Nov 14,13:30,GMT,cad,CAD International Merchandise Trade (Canadian dollar),Low,-0.44B,-1.00B,-1.09B
Thu Nov 14,13:30,GMT,usd,USD Initial Jobless Claims,Medium,339K,330K,341K
Thu Nov 14,13:30,GMT,usd,USD Continuing Claims,Low,2874K,2870K,2874K
Thu Nov 14,13:30,GMT,usd,USD Non-Farm Productivity,Low,1.9%,2.2%,1.8%%
Thu Nov 14,13:30,GMT,usd,USD Unit Labor Costs,Low,-0.6%,-0.1%,0.5%
Thu Nov 14,13:30,GMT,usd,USD Trade Balance,Medium,-$41.8B,-$39.0B,-$38.7B
Thu Nov 14,14:00,GMT,USD,USD Fed's Plosser Speaks on Monetary Policy in Washington,Low,,,
Thu Nov 14,15:00,GMT,USD,USD U.S. Senate Banking Committee Confirmation Hearing for Yellen,High,,,
Thu Nov 14,15:30,GMT,usd,USD EIA Natural Gas Storage Change,Low,20,23,35
Thu Nov 14,16:00,GMT,usd,USD DOE Cushing OK Crude Inventory,Low,1691K,,991K
Thu Nov 14,16:00,GMT,usd,USD DOE U.S. Gasoline Inventories,Low,-838K,-900K,-3755K
Thu Nov 14,16:00,GMT,usd,USD DOE U.S. Crude Oil Inventories,Low,2640K,800K,1577K
Thu Nov 14,16:00,GMT,usd,USD DOE U.S. Distillate Inventory,Low,-481,-1000K,-4899K
Fri Nov 15,08:00,GMT,eur,EUR EU Finance Ministers Meet in Brussels,Medium,,,
Fri Nov 15,10:00,GMT,eur,EUR Euro-Zone Consumer Price Index (YoY),High,0.7%,0.7%,0.7%
Fri Nov 15,10:00,GMT,eur,EUR Euro-Zone Consumer Price Index - Core (YoY),High,0.8%,0.8%,0.8%
Fri Nov 15,10:00,GMT,eur,EUR Euro-Zone Consumer Price Index (MoM),Medium,-0.1%,-0.1%,0.5%
Fri Nov 15,13:30,GMT,cad,CAD Manufacturing Sales (MoM),Low,0.6%,0.5%,0.0%
Fri Nov 15,13:30,GMT,usd,USD Import Price Index (MoM),Low,-0.7%,-0.5%,0.1%
Fri Nov 15,13:30,GMT,usd,USD Empire Manufacturing,Low,-2.21,5.00,1.52
Fri Nov 15,13:30,GMT,usd,USD Import Price Index (YoY),Low,-2.0%,-1.6%,-1.0%
Fri Nov 15,14:00,GMT,cad,CAD Existing Home Sales (MoM),Low,-3.2%,,0.8%
Fri Nov 15,14:15,GMT,usd,USD Industrial Production,Medium,-0.1%,0.2%,0.7%
Fri Nov 15,14:15,GMT,usd,USD Manufacturing (SIC) Production,Medium,0.3%,0.2%,0.1%
Fri Nov 15,14:15,GMT,usd,USD Capacity Utilization,Low,78.1%,78.3%,78.3%
Fri Nov 15,14:30,GMT,usd,USD EU and US Negotiators Brief Press on Trade Talks,Low,,,
Fri Nov 15,15:00,GMT,usd,USD Wholesale Trade Sales (MoM),Low,0.6%,0.3%,0.4%
Fri Nov 15,15:00,GMT,usd,USD Wholesale Inventories,Low,0.4%,0.4%,0.8%
