Date,Time,Time Zone,Currency,Description,Importance,Actual,Forecast,Previous
Sun Feb 26,21:45,GMT,nzd,NZD Trade Balance (New Zealand dollars),Medium,-199M,167M,306M
Sun Feb 26,21:45,GMT,nzd,NZD Exports (New Zealand dollars),Low,3.74B,3.70B,4.29B
Sun Feb 26,21:45,GMT,nzd,NZD Imports (New Zealand dollars),Low,3.94B,3.51B,3.99B
Sun Feb 26,21:45,GMT,nzd,NZD Balance (YTD) (New Zealand dollars),Medium,646M,1300M,853M
Mon Feb 27,00:01,GMT,gbp,GBP Hometrack Housing Survey (MoM),Low,0.0%,,0.0%
Mon Feb 27,00:01,GMT,gbp,GBP Hometrack Housing Survey (YoY),Low,-1.4%,,-1.6%
Mon Feb 27,01:40,GMT,aud,AUD CBAHIA House Affordability,Low,58.5,,57.2
Mon Feb 27,07:45,GMT,eur,EUR French Producer Prices (MoM) ,Low,0.6%,0.4%,-0.1%
Mon Feb 27,07:45,GMT,eur,EUR French Producer Prices (YoY) ,Medium,4.2%,4.1%,4.6%
Mon Feb 27,09:00,GMT,eur,EUR Euro-Zone M3 s.a. (3M),Low,2.0%,1.8%,2.1%
Mon Feb 27,09:00,GMT,eur,EUR Euro-Zone M3 s.a. (YoY),Low,2.5%,1.8%,1.6%
Mon Feb 27,09:00,GMT,eur,EUR Italian Business Confidence,Low,91.5,92,92.1
Mon Feb 27,15:00,GMT,usd,USD Pending Home Sales (MoM),Low,2.0%,1.0%,-1.9%
Mon Feb 27,15:00,GMT,usd,USD Pending Home Sales (YoY),Medium,10.3%,10.7%,4.4%
Mon Feb 27,15:30,GMT,usd,USD Dallas Fed Manufacturing Activity,Low,17.8,15.9,15.3
Mon Feb 27,23:50,GMT,jpy,JPY Retail Trade s.a. (MoM),Low,4.1%,1.0%,0.3%
Mon Feb 27,23:50,GMT,jpy,JPY Retail Trade (YoY),Medium,1.9%,-0.1%,2.5%
Mon Feb 27,23:50,GMT,jpy,JPY Large Retailers' Sales,Medium,-1.0%,-1.1%,-0.3%
Tue Feb 28,05:00,GMT,jpy,JPY Small Business Confidence,Low,45.3,,45.7
Tue Feb 28,07:00,GMT,eur,EUR German GfK Consumer Confidence Survey (MAR),Medium,6.0,6.0,5.9
Tue Feb 28,07:00,GMT,chf,CHF UBS Consumption Indicator,Medium,0.92,,0.94
Tue Feb 28,10:00,GMT,eur,EUR Euro-Zone Business Climate Indicator,Medium,-0.18,-0.15,-0.21
Tue Feb 28,10:00,GMT,eur,EUR Euro-Zone Consumer Confidence,Medium,-20.3,-20.2,-20.2
Tue Feb 28,10:00,GMT,eur,EUR Euro-Zone Economic Confidence,Medium,94.4,94,93.4
Tue Feb 28,10:00,GMT,eur,EUR Euro-Zone Industrial Confidence,Medium,-5.8,-6.9,-7.0
Tue Feb 28,10:00,GMT,eur,EUR Euro-Zone Services Confidence,Medium,-0.9%,-0.6,-0.7
Tue Feb 28,11:00,GMT,gbp,GBP CBI Reported Sales,Low,-2,-12,-22
Tue Feb 28,13:30,GMT,eur,EUR German Consumer Price Index (MoM),Medium,0.7%,0.5%,-0.4%
Tue Feb 28,13:30,GMT,eur,EUR German Consumer Price Index (YoY),High,2.3%,2.1%,2.1%
Tue Feb 28,13:30,GMT,eur,EUR German Consumer Price Index - EU Harmonised (MoM),Medium,0.9%,0.5%,-0.5%
Tue Feb 28,13:30,GMT,eur,EUR German Consumer Price Index - EU Harmonised (YoY),High,2.5%,2.2%,2.3%
Tue Feb 28,13:30,GMT,usd,USD Durable Goods Orders,High,-4.0%,-1.0%,3.2%
Tue Feb 28,13:30,GMT,usd,USD Durables Ex Transportation,Medium,-3.2%,0.0%,2.1%
Tue Feb 28,13:30,GMT,usd,USD Cap Goods Orders Nondef Ex Air,Low,-4.5%,-1.3%,3.4%
Tue Feb 28,13:30,GMT,usd,USD Cap Goods Ship Nondef Ex Air,Low,-3.1%,-0.9%,2.8%
Tue Feb 28,14:00,GMT,usd,USD S&P/CS 20 City s.a. (MoM),Low,-0.50%,-0.35%,-0.74%
Tue Feb 28,14:00,GMT,usd,USD S&P/Case-Shiller Composite-20 (YoY),Low,-3.99%,-3.65%,-3.85%
Tue Feb 28,14:00,GMT,usd,USD S&P/Case-Shiller US Home Price Index (YoY),Low,-4.03%,-4.30%,-3.70%
Tue Feb 28,14:00,GMT,usd,USD S&P/Case-Shiller Home Price Index,Low,136.71,137.11,138.24
Tue Feb 28,14:00,GMT,usd,USD S&P/Case-Shiller US Home Price Index,Low,125.67,,130.66
Tue Feb 28,15:00,GMT,usd,USD Consumer Confidence,Medium,70.8,63.0,61.5
Tue Feb 28,15:00,GMT,usd,USD Richmond Fed Manufacturing Index,Low,20,10,12
Tue Feb 28,21:45,GMT,nzd,NZD Building Permits (MoM),Low,8.3%,3.4%,2.1%
Tue Feb 28,23:15,GMT,jpy,JPY Nomura/JMMA Manufacturing Purchasing Manager Index,Medium,50.5,,50.7
Tue Feb 28,23:30,GMT,AUD,AUD RPData-Rismark House Px Raw,LOW,,,-1.2%
Tue Feb 28,23:30,GMT,AUD,AUD RPData-Rismark House Px s.a.,LOW,,,-0.2%
Tue Feb 28,23:50,GMT,jpy,JPY Industrial Production (MoM),Low,2.0%,1.5%,3.8%
Tue Feb 28,23:50,GMT,jpy,JPY Industrial Production (YoY),Medium,-1.2%,-1.6%,-4.3%
Wed Feb 29,00:00,GMT,aud,AUD HIA New Home Sales (MoM),Medium,-7.3%,,-4.9%
Wed Feb 29,00:00,GMT,nzd,NZD NBNZ Activity Outlook,Medium,31.2,,25.7
Wed Feb 29,00:00,GMT,nzd,NZD NBNZ Business Confidence,Medium,28.0,,16.9
Wed Feb 29,,,JPY,JPY BOJ Conference, Fukuoka City, Japan,Medium,,,
Wed Feb 29,00:01,GMT,gbp,GBP GfK Consumer Confidence Survey,Medium,-29,-27,-29
Wed Feb 29,00:15,GMT,USD,USD Fed's Pianalto Speaks on Economy in Westfield Center, Ohio,LOW,,,
Wed Feb 29,00:30,GMT,aud,AUD Construction Work Done,Low,-4.6%,-0.8%,11.7%
Wed Feb 29,00:30,GMT,AUD,AUD Company Operating Profit (QoQ),LOW,,,4.8%
Wed Feb 29,00:30,GMT,aud,AUD Private Sector Credit (MoM),Medium,0.2%,0.3%,0.3%
Wed Feb 29,00:30,GMT,aud,AUD Private Sector Credit (YoY),Medium,3.5%,3.6%,3.5%
Wed Feb 29,00:30,GMT,aud,AUD Retail Sales s.a. (MoM),Medium,0.3%,0.3%,-0.1%
Wed Feb 29,02:00,GMT,nzd,NZD Money Supply M3 (YoY),Low,5.4%,,5.9%
Wed Feb 29,04:00,GMT,jpy,JPY Vehicle Production (YoY),Low,18.6%,,13.4%
Wed Feb 29,05:00,GMT,jpy,JPY Construction Orders (YoY),Low,24.6%,,1.5%
Wed Feb 29,05:00,GMT,jpy,JPY Annualized Housing Starts,Medium,0.822M,0.808M,0.783M
Wed Feb 29,05:00,GMT,jpy,JPY Housing Starts (YoY),Medium,-1.1%,-3.3%,-7.3%
Wed Feb 29,07:00,GMT,eur,EUR German Import Price Index (MoM),Low,1.3%,0.8%,0.3%
Wed Feb 29,07:00,GMT,eur,EUR German Import Price Index (YoY),Low,3.7%,3.2%,3.9%
Wed Feb 29,08:00,GMT,chf,CHF KOF Swiss Leading Indicator,Medium,-0.12,-0.10,-0.15
Wed Feb 29,08:55,GMT,eur,EUR German Unemployment Change,High,0K,-5K,-26K
Wed Feb 29,08:55,GMT,eur,EUR German Unemployment Rate s.a.,Medium,6.8%,6.7%,6.8%
Wed Feb 29,09:30,GMT,gbp,GBP Net Consumer Credit,Medium,0.1B,0.2B,0.0B
Wed Feb 29,09:30,GMT,gbp,GBP Net Lending Sec. on Dwellings,Medium,1.6B,1.0B,1.0B
Wed Feb 29,09:30,GMT,gbp,GBP Mortgage Approvals,Medium,58.7K,54.0K,55.0K
Wed Feb 29,09:30,GMT,gbp,GBP M4 Money Supply (MoM),Low,1.6%,,-1.4%
Wed Feb 29,09:30,GMT,gbp,GBP M4 Money Supply (YoY),Low,-1.8%,,-2.5%
Wed Feb 29,09:30,GMT,gbp,GBP M4 Ex IOFCs 3M Annualised,Low,4.2%,,-0.9%
Wed Feb 29,10:00,GMT,eur,EUR Euro-Zone Consumer Price Index - Core (YoY),High,1.5%,1.7%,1.6%
Wed Feb 29,10:00,GMT,eur,EUR Euro-Zone Consumer Price Index (MoM),Medium,-0.8%,-0.8%,0.3%
Wed Feb 29,10:00,GMT,eur,EUR Euro-Zone Consumer Price Index (YoY),High,2.6%,2.7%,2.7%
Wed Feb 29,10:00,GMT,chf,CHF CPI EU Harmonized (MoM) ,Medium,-0.7%,-0.3%,0.3%
Wed Feb 29,10:00,GMT,chf,CHF CPI EU Harmonized (YoY) ,High,-0.9%,-0.7%,-0.4%
Wed Feb 29,10:15,GMT,eur,EUR ECB LTRO 3 Month and 3 Year Allotment Announcements,High,,,
Wed Feb 29,12:00,GMT,usd,USD MBA Mortgage Applications,Low,-0.3%,,-4.5%
Wed Feb 29,13:30,GMT,usd,USD Gross Domestic Product (Annualized),High,3.0%,2.8%,2.8%
Wed Feb 29,13:30,GMT,usd,USD Personal Consumption,Medium,2.1%,1.9%,2.0%
Wed Feb 29,13:30,GMT,usd,USD Gross Domestic Product Price Index,High,0.9%,0.4%,0.4%
Wed Feb 29,13:30,GMT,usd,USD Core Personal Consumption Expenditure (QoQ),High,1.3%,1.1%,1.1%
Wed Feb 29,14:00,GMT,cad,CAD Teranet/National Bank HPI (MoM),Low,-0.2%,-0.2%,-0.2%
Wed Feb 29,14:00,GMT,cad,CAD Teranet/National Bank HPI (YoY),Low,6.8%,,7.1%
Wed Feb 29,14:00,GMT,cad,CAD Teranet/National Bank HP Index,Low,148.87,,149.11
Wed Feb 29,14:30,GMT,usd,USD Fed's Fisher Speaks on economy in Mexico City,Low,,,
Wed Feb 29,14:45,GMT,usd,USD Chicago Purchasing Manager,Low,64.0,61.8,60.2
Wed Feb 29,15:00,GMT,usd,USD Fed's Bernanke Delivers Semi-Annual Monetary Policy Report,Medium,,,
Wed Feb 29,15:00,GMT,usd,USD NAPM-Milwaukee,Low,58.6,58.8,58.4
Wed Feb 29,15:30,GMT,usd,USD DOE U.S. Crude Oil Inventories,Low,4160K,1100K,1633K
Wed Feb 29,15:30,GMT,usd,USD DOE Cushing OK Crude Inventory,Low,1648K,,-315K
Wed Feb 29,15:30,GMT,usd,USD DOE U.S. Distillate Inventory,Low,-2069K,-750K,-208K
Wed Feb 29,15:30,GMT,usd,USD DOE U.S. Gasoline Inventories,Low,-1600K,-425K,-649K
Wed Feb 29,18:00,GMT,usd,USD Fed's Plosser Speaks on Economy in New York,Low,,,
Wed Feb 29,19:00,GMT,USD,USD Fed Releases Beige Book Economic Survey,Medium,,,
Wed Feb 29,21:45,GMT,nzd,NZD Terms of Trade Index (QoQ),Medium,-1.4%,-1.9%,-0.6%
Wed Feb 29,22:30,GMT,aud,AUD AiG Performance of Manufacturing Index,Medium,51.3,,51.6
Wed Feb 29,23:50,GMT,jpy,JPY Loans & Discounts Corp (YoY),Low,0.0%,,0.0%
Wed Feb 29,23:50,GMT,jpy,JPY Capital Spending excl Software,Medium,4.9%,-7.4%,-11.0%
Wed Feb 29,23:50,GMT,jpy,JPY Capital Spending,Medium,7.6%,-6.5%,-9.8%
Thu Mar 01,,,JPY,JPY Official Reserve Assets,LOW,,,$1306.7B
Thu Mar 01,00:30,GMT,aud,AUD Private Capital Expenditure,Low,-0.3%,3.8%,14.6%
Thu Mar 01,01:00,GMT,cny,CNY PMI Manufacturing,High,51.0,50.8,50.5
Thu Mar 01,02:30,GMT,cny,CNY HSBC Manufacturing PMI,Medium,49.6,,48.8
Thu Mar 01,05:00,GMT,jpy,JPY Vehicle Sales (YoY),Low,31.9%,,40.7%
Thu Mar 01,05:30,GMT,aud,AUD RBA Commodity Price Index,Low,98.1,,99.4
Thu Mar 01,05:30,GMT,aud,AUD RBA Commodity Index SDR (YoY),Low,3.5%,,6.0%
Thu Mar 01,06:30,GMT,eur,French ILO Mainland Unemployment Rate,Low,9.4%,9.6%,9.3%
Thu Mar 01,06:30,GMT,eur,French ILO Unemployment Rate,Low,9.8%,,9.7%
Thu Mar 01,06:30,GMT,eur,French ILO Mainland Unemployment Change,Low,50K,,42K
Thu Mar 01,06:45,GMT,chf,CHF Gross Domestic Product (QoQ),Medium,0.1%,-0.1%,0.3%
Thu Mar 01,06:45,GMT,chf,CHF Gross Domestic Product (YoY),Medium,1.3%,1.1%,1.6%
Thu Mar 01,07:00,GMT,gbp,GBP Nationwide House Prices s.a. (MoM),Low,0.6%,0.3%,-0.3%
Thu Mar 01,07:00,GMT,gbp,GBP Nationwide House Prices n.s.a. (YoY),Medium,0.9%,0.3%,0.6%
Thu Mar 01,08:30,GMT,chf,CHF SVME-Purchasing Managers Index,Medium,49.9,48.5,47.3
Thu Mar 01,08:45,GMT,eur,EUR Italian Purchasing Manager Index Manufacturing,Low,47.8,47.1,46.8
Thu Mar 01,08:50,GMT,eur,EUR French Purchasing Manager Index Manufacturing,Low,50.0,50.2,50.2
Thu Mar 01,08:55,GMT,eur,EUR German Purchasing Manager Index Manufacturing,Medium,50.2,50.1,50.1
Thu Mar 01,09:00,GMT,eur,EUR Italian Unemployment Rate s.a.,Low,9.2%,8.9%,8.9%
Thu Mar 01,09:00,GMT,eur,EUR Euro-Zone Purchasing Manager Index Manufacturing,Medium,49.0,49.0,49.0
Thu Mar 01,09:30,GMT,gbp,GBP Purchasing Manager Index Manufacturing,Medium,51.2,52,52.1
Thu Mar 01,10:00,GMT,eur,EUR Euro-Zone Consumer Price Index Estimate (YoY),High,2.7%,2.6%,2.7%
Thu Mar 01,10:00,GMT,eur,EUR Euro-Zone Unemployment Rate,Medium,10.7%,10.4%,10.4%
Thu Mar 01,13:30,GMT,cad,CAD Current Account (BoP) (Canadian dollar),Medium,-$10.3B,-$9.6B,-$12.3B
Thu Mar 01,13:30,GMT,cad,CAD Industrial Product Price (MoM),Low,0.3%,0.3%,-0.9%
Thu Mar 01,13:30,GMT,cad,CAD Raw Materials Price Index (MoM),Low,0.1%,0.5%,-2.5%
Thu Mar 01,13:30,GMT,usd,USD Personal Income,Medium,0.3%,0.5%,0.5%
Thu Mar 01,13:30,GMT,usd,USD Personal Spending,Medium,0.2%,0.4%,0.0%
Thu Mar 01,13:30,GMT,usd,USD Personal Consumption Expenditure Deflator (YoY),Low,2.4%,2.3%,2.5%
Thu Mar 01,13:30,GMT,usd,USD Personal Consumption Expenditure Core (MoM),Medium,0.2%,0.2%,0.1%
Thu Mar 01,13:30,GMT,usd,USD Personal Consumption Expenditure Core (YoY),High,1.9%,1.8%,1.9%
Thu Mar 01,13:30,GMT,usd,USD Initial Jobless Claims,Low,351K,355K,353K
Thu Mar 01,13:30,GMT,usd,USD Continuing Claims,Low,3402K,3418K,3404K
Thu Mar 01,15:00,GMT,usd,USD Construction Spending (MoM),Medium,-0.1%,1.0%,1.4%
Thu Mar 01,15:00,GMT,usd,USD ISM Manufacturing,High,52.4,54.5,54.1
Thu Mar 01,15:00,GMT,usd,USD ISM Prices Paid,Medium,61.5,56.3,55.5
Thu Mar 01,15:30,GMT,usd,USD EIA Natural Gas Storage Change,Low,-82,,-166
Thu Mar 01,17:30,GMT,usd,USD Fed's Lockhart Speaks on Economy and Banking in Atlanta,Low,,,
Thu Mar 01,18:00,GMT,EUR,EUR Italian Budget Balance (euros) (YTD),LOW,,,-3.3B
Thu Mar 01,18:00,GMT,eur,EUR Italian Budget Balance (euros),Low,-7.4B,,-3.3B
Thu Mar 01,22:00,GMT,usd,USD Total Vehicle Sales,Low,15.03M,14.00M,14.13M
Thu Mar 01,22:00,GMT,usd,USD Domestic Vehicle Sales,Low,11.70M,11.00M,11.05M
Thu Mar 01,23:30,GMT,jpy,JPY Job-To-Applicant Ratio,Low,0.73,0.72,0.71
Thu Mar 01,23:30,GMT,jpy,JPY Tokyo Consumer Price Index Ex Food, Energy (YoY),Low,-1.1%,-1.1%,-1.1%
Thu Mar 01,23:30,GMT,jpy,JPY Household Spending (YoY),Medium,-2.3%,-0.9%,0.5%
Thu Mar 01,23:30,GMT,jpy,JPY Jobless Rate,Medium,4.6%,4.5%,4.5%
Thu Mar 01,23:30,GMT,jpy,JPY Tokyo Consumer Price Index (YoY),Low,-0.2%,-0.2%,-0.2%
Thu Mar 01,23:30,GMT,jpy,JPY Tokyo Consumer Price Index Ex-Fresh Food (YoY),Low,-0.3%,-0.4%,-0.4%
Thu Mar 01,23:30,GMT,jpy,JPY National Consumer Price Index (YoY),Medium,0.1%,-0.1%,-0.2%
Thu Mar 01,23:30,GMT,jpy,JPY National Consumer Price Index Ex-Fresh Food (YoY),Medium,-0.1%,-0.2%,-0.1%
Thu Mar 01,23:30,GMT,jpy,JPY National Consumer Price Index Ex Food, Energy (YoY),Medium,-0.9%,-1.1%,-1.1%
Thu Mar 01,23:50,GMT,jpy,JPY Monetary Base (YoY),Low,11.3%,,15.0%
Fri Mar 02,00:00,GMT,nzd,NZD ANZ Commodity Price,Low,0.0%,,1.1%
Fri Mar 02,,,USD,USD ICSC Chain Store Sales (YoY),Medium,,,4.8%
Fri Mar 02,01:00,GMT,USD,USD Fed's Bullard Speaks on U.S. Economy in Vancouver,LOW,,,
Fri Mar 02,01:00,GMT,CNY,CNY China Non-manufacturing PMI,Medium,,,52.9
Fri Mar 02,04:30,GMT,USD,USD Fed's Williams Speaks in Honolulu, HI,LOW,,,
Fri Mar 02,07:00,GMT,eur,EUR German Retail Sales (MoM),Low,-1.6%,0.5%,0.1%
Fri Mar 02,07:00,GMT,eur,EUR German Retail Sales (YoY),Medium,1.6%,0.2%,0.3%
Fri Mar 02,09:30,GMT,gbp,GBP Purchasing Manager Index Construction,Medium,54.3,51.3,51.4
Fri Mar 02,10:00,GMT,eur,EUR Euro-Zone Producer Price Index (MoM),Medium,0.7%,0.5%,-0.2%
Fri Mar 02,10:00,GMT,eur,EUR Euro-Zone Producer Price Index (YoY),High,3.7%,3.5%,4.3%
Fri Mar 02,10:00,GMT,eur,EUR Italian Deficit to GDP,Low,3.9%,4.0%,4.6%
Fri Mar 02,10:00,GMT,eur,EUR Italian Annual Gross Domestic Product,Low,0.4%,0.3%,1.8%
Fri Mar 02,13:30,GMT,cad,CAD Gross Domestic Product (MoM),High,0.4%,0.3%,-0.1%
Fri Mar 02,13:30,GMT,cad,CAD Gross Domestic Product (YoY),High,1.8%,1.9%,2.1%
Fri Mar 02,13:30,GMT,cad,CAD Quarterly Gross Domestic Product Annualized,High,1.8%,1.8%,4.2%
